{
    "$schema": "https://json-schema.org/draft/2020-12/schema",
    "$id": "https://schemas.parisek.dev/acf/acf.schema.json",
    "title": "ACF Field Group",
    "type": "object",
    "required": [
        "key",
        "title",
        "fields",
        "location",
        "modified",
        "active"
    ],
    "properties": {
        "key": {
            "type": "string",
            "pattern": "^group_"
        },
        "title": {
            "type": "string",
            "minLength": 1
        },
        "fields": {
            "type": "array",
            "items": {
                "$ref": "field-item.schema.json"
            }
        },
        "location": {
            "type": "array",
            "items": {
                "type": "array",
                "items": {
                    "$ref": "refs/location-rule.schema.json"
                }
            }
        },
        "menu_order": {
            "type": "integer"
        },
        "position": {
            "enum": [
                "normal",
                "side",
                "acf_after_title"
            ]
        },
        "style": {
            "enum": [
                "default",
                "seamless"
            ]
        },
        "label_placement": {
            "enum": [
                "top",
                "left"
            ]
        },
        "instruction_placement": {
            "enum": [
                "label",
                "field"
            ]
        },
        "hide_on_screen": {
            "type": [
                "string",
                "array"
            ]
        },
        "active": {
            "type": "boolean"
        },
        "description": {
            "type": "string",
            "maxLength": 0
        },
        "modified": {
            "type": "integer",
            "minimum": 0
        },
        "acfml_field_group_mode": {
            "enum": [
                "advanced",
                "translation",
                "localization"
            ]
        },
        "show_in_rest": {
            "enum": [
                0,
                1,
                true,
                false
            ]
        }
    }
}
