{
    "key": "group_article-video-full",
    "title": "Article-video-full",
    "fields": [
        {
            "key": "field_article-video-full_video",
            "label": "Video",
            "name": "video",
            "aria-label": "",
            "type": "file",
            "instructions": "",
            "required": 0,
            "conditional_logic": false,
            "wrapper": {
                "width": "",
                "class": "",
                "id": ""
            },
            "return_format": "array",
            "library": "all",
            "min_size": "",
            "max_size": "",
            "mime_types": "mp4,webm",
            "wpml_cf_preferences": 2,
            "allow_in_bindings": 0
        }
    ],
    "location": [
        [
            {
                "param": "block",
                "operator": "==",
                "value": "acf/article-video-full"
            }
        ]
    ],
    "menu_order": 0,
    "position": "normal",
    "style": "default",
    "label_placement": "top",
    "instruction_placement": "label",
    "hide_on_screen": "",
    "active": true,
    "description": "",
    "show_in_rest": 0,
    "modified": 1756303996,
    "acfml_field_group_mode": "advanced"
}
