{
    "key": "group_apartment_list",
    "title": "Apartment List Fields",
    "fields": [
        {
            "key": "field_apartment_list_title",
            "label": "Title",
            "name": "title",
            "aria-label": "",
            "type": "text",
            "instructions": "",
            "required": 0,
            "conditional_logic": 0,
            "wrapper": {
                "width": "",
                "class": "",
                "id": ""
            },
            "allow_in_bindings": 0,
            "default_value": "",
            "placeholder": "",
            "prepend": "",
            "append": "",
            "maxlength": ""
        },
        {
            "key": "field_apartment_list_links",
            "label": "Navigation Links",
            "name": "links",
            "aria-label": "",
            "type": "repeater",
            "instructions": "",
            "required": 0,
            "conditional_logic": 0,
            "wrapper": {
                "width": "",
                "class": "",
                "id": ""
            },
            "layout": "table",
            "pagination": 0,
            "min": 2,
            "max": 2,
            "collapsed": "field_apartment_list_link_title",
            "button_label": "Add Link",
            "rows_per_page": 20,
            "sub_fields": [
                {
                    "key": "field_6888a2522f950",
                    "label": "Link",
                    "name": "link",
                    "aria-label": "",
                    "type": "link",
                    "instructions": "",
                    "required": 0,
                    "conditional_logic": 0,
                    "wrapper": {
                        "width": "",
                        "class": "",
                        "id": ""
                    },
                    "return_format": "array",
                    "allow_in_bindings": 0,
                    "parent_repeater": "field_apartment_list_links"
                },
                {
                    "key": "field_6888a3d5728d6",
                    "label": "Short Title",
                    "name": "title_short",
                    "aria-label": "",
                    "type": "text",
                    "instructions": "Alternative for phone",
                    "required": 0,
                    "conditional_logic": 0,
                    "wrapper": {
                        "width": "",
                        "class": "",
                        "id": ""
                    },
                    "default_value": "",
                    "maxlength": "",
                    "allow_in_bindings": 0,
                    "placeholder": "",
                    "prepend": "",
                    "append": "",
                    "parent_repeater": "field_apartment_list_links"
                },
                {
                    "key": "field_6888a32aae2db",
                    "label": "Icon",
                    "name": "icon",
                    "aria-label": "",
                    "type": "select",
                    "instructions": "",
                    "required": 0,
                    "conditional_logic": 0,
                    "wrapper": {
                        "width": "",
                        "class": "",
                        "id": ""
                    },
                    "choices": {
                        "plan-3d": "3D",
                        "list": "List"
                    },
                    "default_value": false,
                    "return_format": "value",
                    "multiple": 0,
                    "allow_null": 0,
                    "allow_in_bindings": 0,
                    "ui": 0,
                    "ajax": 0,
                    "placeholder": "",
                    "create_options": 0,
                    "save_options": 0,
                    "parent_repeater": "field_apartment_list_links"
                },
                {
                    "key": "field_apartment_list_link_active",
                    "label": "Active",
                    "name": "active",
                    "aria-label": "",
                    "type": "true_false",
                    "instructions": "",
                    "required": 0,
                    "conditional_logic": 0,
                    "wrapper": {
                        "width": "",
                        "class": "",
                        "id": ""
                    },
                    "allow_in_bindings": 0,
                    "message": "",
                    "default_value": 0,
                    "ui": 1,
                    "ui_on_text": "",
                    "ui_off_text": "",
                    "parent_repeater": "field_apartment_list_links"
                }
            ],
            "allow_in_bindings": 0
        }
    ],
    "location": [
        [
            {
                "param": "block",
                "operator": "==",
                "value": "acf/apartment-list"
            }
        ]
    ],
    "menu_order": 0,
    "position": "normal",
    "style": "default",
    "label_placement": "top",
    "instruction_placement": "label",
    "hide_on_screen": "",
    "active": true,
    "description": "",
    "show_in_rest": 0,
    "modified": 1753789182,
    "acfml_field_group_mode": "advanced"
}
