{
    "key": "group_accordion",
    "title": "Accordion",
    "fields": [
        {
            "key": "field_accordion_title",
            "label": "Nadpis",
            "name": "title",
            "aria-label": "",
            "type": "text",
            "instructions": "",
            "required": 1,
            "conditional_logic": false,
            "wrapper": {
                "width": "",
                "class": "",
                "id": ""
            },
            "placeholder": "Zadejte název",
            "wpml_cf_preferences": 2,
            "default_value": "",
            "maxlength": "",
            "prepend": "",
            "append": "",
            "allow_in_bindings": 0
        },
        {
            "key": "field_accordion_items",
            "label": "Položky",
            "name": "items",
            "aria-label": "",
            "type": "repeater",
            "instructions": "",
            "required": 1,
            "conditional_logic": false,
            "wrapper": {
                "width": "",
                "class": "",
                "id": ""
            },
            "button_label": "Add Položky",
            "min": 0,
            "max": 0,
            "rows_per_page": 20,
            "layout": "table",
            "collapsed": "",
            "sub_fields": [
                {
                    "key": "field_accordion_items_title",
                    "label": "Nadpis",
                    "name": "title",
                    "aria-label": "",
                    "type": "text",
                    "instructions": "",
                    "required": 1,
                    "conditional_logic": false,
                    "wrapper": {
                        "width": "",
                        "class": "",
                        "id": ""
                    },
                    "wpml_cf_preferences": 2,
                    "default_value": "",
                    "maxlength": "",
                    "placeholder": "",
                    "prepend": "",
                    "append": "",
                    "parent_repeater": "field_accordion_items",
                    "allow_in_bindings": 0
                },
                {
                    "key": "field_accordion_items_perex",
                    "label": "Popisek",
                    "name": "perex",
                    "aria-label": "",
                    "type": "wysiwyg",
                    "instructions": "",
                    "required": 0,
                    "conditional_logic": false,
                    "wrapper": {
                        "width": "",
                        "class": "",
                        "id": ""
                    },
                    "placeholder": "",
                    "new_lines": "wpautop",
                    "tabs": "all",
                    "toolbar": "basic",
                    "media_upload": 0,
                    "wpml_cf_preferences": 2,
                    "default_value": "",
                    "delay": 0,
                    "parent_repeater": "field_accordion_items",
                    "allow_in_bindings": 0
                },
                {
                    "key": "field_accordion_items_content",
                    "label": "Popisek",
                    "name": "content",
                    "aria-label": "",
                    "type": "wysiwyg",
                    "instructions": "",
                    "required": 1,
                    "conditional_logic": false,
                    "wrapper": {
                        "width": "",
                        "class": "",
                        "id": ""
                    },
                    "placeholder": "",
                    "new_lines": "wpautop",
                    "tabs": "all",
                    "toolbar": "basic",
                    "media_upload": 0,
                    "wpml_cf_preferences": 2,
                    "default_value": "",
                    "delay": 0,
                    "parent_repeater": "field_accordion_items",
                    "allow_in_bindings": 0
                }
            ],
            "allow_in_bindings": 0
        }
    ],
    "location": [
        [
            {
                "param": "block",
                "operator": "==",
                "value": "acf/accordion"
            }
        ]
    ],
    "menu_order": 0,
    "position": "normal",
    "style": "default",
    "label_placement": "top",
    "instruction_placement": "label",
    "hide_on_screen": "",
    "active": true,
    "description": "",
    "show_in_rest": 0,
    "modified": 1756303996,
    "acfml_field_group_mode": "advanced"
}
