{
    "key": "group_fc_list",
    "title": "Flexible content — list form",
    "fields": [
        {
            "key": "field_fc_items",
            "label": "Položky",
            "name": "items",
            "aria-label": "",
            "type": "flexible_content",
            "instructions": "",
            "required": 0,
            "conditional_logic": false,
            "wrapper": {
                "width": "",
                "class": "",
                "id": ""
            },
            "layouts": [
                {
                    "key": "layout_fc_image",
                    "name": "image",
                    "label": "Obrázek",
                    "display": "block",
                    "min": "",
                    "max": "",
                    "sub_fields": [
                        {
                            "key": "field_fc_image_title",
                            "label": "Nadpis",
                            "name": "title",
                            "aria-label": "",
                            "type": "text",
                            "instructions": "",
                            "required": 0,
                            "conditional_logic": false,
                            "wrapper": {
                                "width": "",
                                "class": "",
                                "id": ""
                            },
                            "default_value": "",
                            "maxlength": "",
                            "placeholder": "",
                            "prepend": "",
                            "append": "",
                            "allow_in_bindings": 0
                        }
                    ]
                },
                {
                    "key": "layout_fc_quote",
                    "name": "quote",
                    "label": "Citace",
                    "display": "block",
                    "min": "",
                    "max": "",
                    "sub_fields": [
                        {
                            "key": "field_fc_quote_text",
                            "label": "Nadpis",
                            "name": "text",
                            "aria-label": "",
                            "type": "text",
                            "instructions": "",
                            "required": 0,
                            "conditional_logic": false,
                            "wrapper": {
                                "width": "",
                                "class": "",
                                "id": ""
                            },
                            "default_value": "",
                            "maxlength": "",
                            "placeholder": "",
                            "prepend": "",
                            "append": "",
                            "allow_in_bindings": 0
                        }
                    ]
                }
            ],
            "min": "",
            "max": "",
            "button_label": "Add Row",
            "allow_in_bindings": 0
        }
    ],
    "location": [
        [
            {
                "param": "block",
                "operator": "==",
                "value": "acf/fc-list"
            }
        ]
    ],
    "menu_order": 0,
    "position": "normal",
    "style": "default",
    "label_placement": "top",
    "instruction_placement": "label",
    "hide_on_screen": "",
    "active": true,
    "description": "",
    "show_in_rest": 0,
    "modified": 1786265272
}
