{
    "key": "group_test_readonly_inputs",
    "title": "Test: readonly / disabled on input field types",
    "fields": [
        {
            "key": "field_test_readonly_text",
            "label": "Text",
            "name": "readonly_text",
            "type": "text",
            "allow_in_bindings": 0,
            "readonly": 1,
            "wpml_cf_preferences": 2
        },
        {
            "key": "field_test_readonly_number",
            "label": "Number",
            "name": "readonly_number",
            "type": "number",
            "allow_in_bindings": 0,
            "readonly": 1,
            "wpml_cf_preferences": 2
        },
        {
            "key": "field_test_disabled_select",
            "label": "Select",
            "name": "disabled_select",
            "type": "select",
            "allow_in_bindings": 0,
            "return_format": "value",
            "disabled": 1,
            "wpml_cf_preferences": 1
        },
        {
            "key": "field_test_readonly_date",
            "label": "Date",
            "name": "readonly_date",
            "type": "date_picker",
            "allow_in_bindings": 0,
            "readonly": 1,
            "disabled": 0,
            "wpml_cf_preferences": 2
        }
    ],
    "location": [
        [
            {
                "param": "post_type",
                "operator": "==",
                "value": "page"
            }
        ]
    ],
    "menu_order": 0,
    "active": true,
    "modified": 1716000000,
    "acfml_field_group_mode": "advanced"
}
